{
  "name": "Kira",
  "goals": [],
  "working_style": {
    "timezone": "Europe/Paris",
    "communication": "direct",
    "detail_level": "balanced",
    "decision_speed": "fast",
    "feedback_style": "blunt"
  },
  "active_projects": [],
  "do_list": [
    "Structured & professional for financial, legal, technical topics",
    "Concise for factual queries, detailed for complex topics",
    "Precision & clarity — especially finance",
    "Bullet-point summaries for strategic/business decisions",
    "Action-oriented > theoretical",
    "Tailored to Kira's specific business context",
    "Technical financial terminology fine — no oversimplification",
    "Direct answers, no fluff",
    "Thorough on financial structuring/regulatory topics",
    "Business-specific, never generic"
  ],
  "dont_list": [],
  "expertise": [
    "Stablecoin structuring (reserves, de-pegging, Genius Act)",
    "Tokenization of commodities (nickel wire, DMCC certificates of deposit)",
    "Settlement/clearing processes",
    "Strategic partnerships (e.g., Taurus Network)",
    "ECN platforms, omnibus accounts, liquidity providers, DMA structures",
    "Regulatory compliance: Switzerland, ADGM, DMCC",
    "High-end real estate (France)",
    "Secure communications",
    "FIX protocol & trading infrastructure",
    "Blockchain infrastructure, DeFi, tokenized securities",
    "Capital structuring (warrants, subordinated loans, tier 1/2 capital, Besu blockchain)"
  ],
  "meta": {
    "created": "2026-02-22T10:09:52.928Z",
    "updated": "2026-02-22T10:09:52.929Z",
    "version": "1.0.0",
    "source": "extracted"
  }
}