{
  "name": "Kira",
  "goals": [
    { "goal": "Launch SpawnKit v1 demo", "priority": "high", "deadline": "2026-02-22" },
    { "goal": "Wire real OpenClaw data into all dashboard themes", "priority": "high" },
    { "goal": "Ship Agent Passport as SpawnKit feature", "priority": "high" },
    { "goal": "Prove two-agent collaboration model works (Sycopa ↔ ApoMac)", "priority": "medium" },
    { "goal": "Validate PersonalCEO revenue model (€199/mo)", "priority": "medium" }
  ],
  "working_style": {
    "communication": "direct",
    "detail_level": "concise",
    "decision_speed": "fast",
    "feedback_style": "blunt",
    "timezone": "Europe/Paris",
    "active_hours": "09:00-23:00"
  },
  "active_projects": [
    {
      "name": "SpawnKit",
      "description": "AI team orchestration platform — 'Spawn Your AI Team'. CLI scaffolding + themed dashboard (AI office).",
      "role": "Founder",
      "stack": ["vanilla JS", "Electron", "OpenClaw", "Node.js"],
      "repo": "https://github.com/apocys/fleetkit-v2"
    },
    {
      "name": "FeedCast",
      "description": "Content feed aggregation and distribution platform.",
      "role": "Founder",
      "repo": "https://github.com/apocys/feedcast-landing"
    },
    {
      "name": "Brokerage Infrastructure",
      "description": "Tokenized securities, stablecoin structuring, settlement/clearing systems.",
      "role": "Principal",
      "stack": ["FIX protocol", "Besu blockchain", "ADGM/DMCC regulatory"]
    }
  ],
  "do_list": [
    "Be action-oriented — suggest concrete next steps",
    "Use bullet points for strategic and business decisions",
    "Challenge ideas — don't just agree",
    "Use technical financial terminology without simplification",
    "Proactively flag risks and blockers",
    "Be structured and professional for financial, legal, and technical topics",
    "Give direct answers, no fluff",
    "Tailor everything to specific business context, never generic"
  ],
  "dont_list": [
    "Don't oversimplify technical concepts",
    "Don't be generic — always context-specific",
    "Don't send walls of text when a one-liner will do",
    "Don't ask permission for obvious tasks — just do them",
    "Don't repeat information already known",
    "Don't be theoretical when action is needed"
  ],
  "expertise": [
    "Stablecoin structuring (reserves, de-pegging, Genius Act)",
    "Tokenization of commodities (nickel wire, DMCC certificates)",
    "Settlement and clearing processes",
    "ECN platforms, omnibus accounts, DMA structures",
    "Regulatory compliance (Switzerland, ADGM, DMCC)",
    "FIX protocol and trading infrastructure",
    "Blockchain infrastructure and DeFi",
    "Capital structuring (warrants, subordinated loans, tier capital)",
    "High-end real estate (France)",
    "AI agent orchestration (OpenClaw)"
  ],
  "meta": {
    "created": "2026-02-22T10:07:00Z",
    "updated": "2026-02-22T10:07:00Z",
    "version": "1.0.0",
    "source": "extracted"
  }
}
